{
  "$schema": "./schema-v1.json",
  "schemaVersion": 1,
  "status": "blocked",
  "network": "robinhood-mainnet",
  "chainId": 4663,
  "paymentToken": "0x5fc5360D0400a0Fd4f2af552ADD042D716F1d168",
  "blocker": "Mainnet deployment is not authorized. Public testnet, brand, artifact freeze, independent audit, independent accounting review, reproducibility, Safe, monitoring, and explicit go/no-go evidence remain incomplete."
}
